{
  "$schema": "https://json-schema.org/draft/2020-12/schema",
  "$id": "https://github.com/stacknil/telemetry-lab/schemas/dedup_explanations.schema.json",
  "title": "Rule evaluation dedup explanations",
  "description": "Schema for demos/rule-evaluation-and-dedup-demo/artifacts/dedup_explanations.json.",
  "type": "array",
  "minItems": 1,
  "items": {
    "type": "object",
    "additionalProperties": false,
    "required": [
      "hit_id",
      "rule_name",
      "severity",
      "alert_time",
      "cooldown_scope",
      "scope_source",
      "cooldown_key",
      "status",
      "reason",
      "group_position",
      "group_size",
      "cooldown_seconds",
      "suppressed_by_hit_id",
      "seconds_since_last_retained",
      "message"
    ],
    "properties": {
      "hit_id": { "type": "string", "minLength": 1 },
      "rule_name": { "type": "string", "minLength": 1 },
      "severity": { "type": "string", "enum": ["low", "medium", "high", "critical"] },
      "alert_time": { "type": "string", "format": "date-time" },
      "cooldown_scope": {
        "type": ["string", "null"],
        "minLength": 1
      },
      "scope_source": { "type": "string", "minLength": 1 },
      "cooldown_key": { "type": "string", "minLength": 1 },
      "status": { "type": "string", "enum": ["retained", "suppressed"] },
      "reason": { "type": "string", "minLength": 1 },
      "group_position": { "type": "integer", "minimum": 1 },
      "group_size": { "type": "integer", "minimum": 1 },
      "cooldown_seconds": { "type": "integer", "minimum": 0 },
      "suppressed_by_hit_id": {
        "type": ["string", "null"],
        "minLength": 1
      },
      "seconds_since_last_retained": {
        "type": ["integer", "null"],
        "minimum": 0
      },
      "message": { "type": "string", "minLength": 1 }
    }
  }
}
