[
  {
    "hit_id": "RH-001",
    "rule_name": "login_fail_burst",
    "severity": "high",
    "alert_time": "2026-03-18T10:01:00Z",
    "cooldown_scope": "entity=account:alice",
    "scope_source": "entity",
    "cooldown_key": "login_fail_burst|entity=account:alice",
    "status": "retained",
    "reason": "kept as the first hit for `login_fail_burst / entity=account:alice`.",
    "group_position": 1,
    "group_size": 3,
    "cooldown_seconds": 180,
    "suppressed_by_hit_id": null,
    "seconds_since_last_retained": null,
    "message": "login_fail_count reached 8, threshold is 8"
  },
  {
    "hit_id": "RH-004",
    "rule_name": "login_fail_burst",
    "severity": "high",
    "alert_time": "2026-03-18T10:01:20Z",
    "cooldown_scope": "entity=account:bob",
    "scope_source": "entity",
    "cooldown_key": "login_fail_burst|entity=account:bob",
    "status": "retained",
    "reason": "kept as the first hit for `login_fail_burst / entity=account:bob`.",
    "group_position": 1,
    "group_size": 2,
    "cooldown_seconds": 180,
    "suppressed_by_hit_id": null,
    "seconds_since_last_retained": null,
    "message": "login_fail_count reached 8, threshold is 8"
  },
  {
    "hit_id": "RH-002",
    "rule_name": "login_fail_burst",
    "severity": "high",
    "alert_time": "2026-03-18T10:01:40Z",
    "cooldown_scope": "entity=account:alice",
    "scope_source": "entity",
    "cooldown_key": "login_fail_burst|entity=account:alice",
    "status": "suppressed",
    "reason": "suppressed because it matched the same cooldown key as retained hit `RH-001` only 40 seconds later, inside the 180 second cooldown.",
    "group_position": 2,
    "group_size": 3,
    "cooldown_seconds": 180,
    "suppressed_by_hit_id": "RH-001",
    "seconds_since_last_retained": 40,
    "message": "login_fail_count reached 9, threshold is 8"
  },
  {
    "hit_id": "RH-005",
    "rule_name": "login_fail_burst",
    "severity": "high",
    "alert_time": "2026-03-18T10:02:00Z",
    "cooldown_scope": "entity=account:bob",
    "scope_source": "entity",
    "cooldown_key": "login_fail_burst|entity=account:bob",
    "status": "suppressed",
    "reason": "suppressed because it matched the same cooldown key as retained hit `RH-004` only 40 seconds later, inside the 180 second cooldown.",
    "group_position": 2,
    "group_size": 2,
    "cooldown_seconds": 180,
    "suppressed_by_hit_id": "RH-004",
    "seconds_since_last_retained": 40,
    "message": "login_fail_count reached 10, threshold is 8"
  },
  {
    "hit_id": "RH-003",
    "rule_name": "login_fail_burst",
    "severity": "high",
    "alert_time": "2026-03-18T10:04:30Z",
    "cooldown_scope": "entity=account:alice",
    "scope_source": "entity",
    "cooldown_key": "login_fail_burst|entity=account:alice",
    "status": "retained",
    "reason": "kept because 210 seconds elapsed since retained hit `RH-001`, which meets the 180 second cooldown.",
    "group_position": 3,
    "group_size": 3,
    "cooldown_seconds": 180,
    "suppressed_by_hit_id": null,
    "seconds_since_last_retained": 210,
    "message": "login_fail_count reached 8, threshold is 8"
  },
  {
    "hit_id": "RH-006",
    "rule_name": "high_error_rate",
    "severity": "medium",
    "alert_time": "2026-03-18T10:05:00Z",
    "cooldown_scope": "source=api-01",
    "scope_source": "source",
    "cooldown_key": "high_error_rate|source=api-01",
    "status": "retained",
    "reason": "kept as the first hit for `high_error_rate / source=api-01`.",
    "group_position": 1,
    "group_size": 3,
    "cooldown_seconds": 180,
    "suppressed_by_hit_id": null,
    "seconds_since_last_retained": null,
    "message": "error_rate 0.46 exceeded 0.30"
  },
  {
    "hit_id": "RH-007",
    "rule_name": "high_error_rate",
    "severity": "medium",
    "alert_time": "2026-03-18T10:06:10Z",
    "cooldown_scope": "source=api-01",
    "scope_source": "source",
    "cooldown_key": "high_error_rate|source=api-01",
    "status": "suppressed",
    "reason": "suppressed because it matched the same cooldown key as retained hit `RH-006` only 70 seconds later, inside the 180 second cooldown.",
    "group_position": 2,
    "group_size": 3,
    "cooldown_seconds": 180,
    "suppressed_by_hit_id": "RH-006",
    "seconds_since_last_retained": 70,
    "message": "error_rate 0.41 exceeded 0.30"
  },
  {
    "hit_id": "RH-009",
    "rule_name": "rare_event_repeat_malware_alert",
    "severity": "high",
    "alert_time": "2026-03-18T10:07:00Z",
    "cooldown_scope": null,
    "scope_source": "unscoped",
    "cooldown_key": "rare_event_repeat_malware_alert|unscoped",
    "status": "retained",
    "reason": "kept as the first hit for `rare_event_repeat_malware_alert / unscoped`.",
    "group_position": 1,
    "group_size": 2,
    "cooldown_seconds": 180,
    "suppressed_by_hit_id": null,
    "seconds_since_last_retained": null,
    "message": "malware_alert repeated 2 times in one window"
  },
  {
    "hit_id": "RH-010",
    "rule_name": "rare_event_repeat_malware_alert",
    "severity": "high",
    "alert_time": "2026-03-18T10:08:00Z",
    "cooldown_scope": null,
    "scope_source": "unscoped",
    "cooldown_key": "rare_event_repeat_malware_alert|unscoped",
    "status": "suppressed",
    "reason": "suppressed because it matched the same cooldown key as retained hit `RH-009` only 60 seconds later, inside the 180 second cooldown.",
    "group_position": 2,
    "group_size": 2,
    "cooldown_seconds": 180,
    "suppressed_by_hit_id": "RH-009",
    "seconds_since_last_retained": 60,
    "message": "malware_alert repeated 3 times in one window"
  },
  {
    "hit_id": "RH-008",
    "rule_name": "high_error_rate",
    "severity": "medium",
    "alert_time": "2026-03-18T10:08:30Z",
    "cooldown_scope": "source=api-01",
    "scope_source": "source",
    "cooldown_key": "high_error_rate|source=api-01",
    "status": "retained",
    "reason": "kept because 210 seconds elapsed since retained hit `RH-006`, which meets the 180 second cooldown.",
    "group_position": 3,
    "group_size": 3,
    "cooldown_seconds": 180,
    "suppressed_by_hit_id": null,
    "seconds_since_last_retained": 210,
    "message": "error_rate 0.44 exceeded 0.30"
  }
]
